url,text,status
https://ucdavis.edu,main open search quick links navigation extended config admissions academics research campus life news uc davis californias college town learn majors cost visit apply ultimate town green laid back friendly walk bike street blocks students fill tables nearby restaurants coffee shops laptops homework friends helps thrive virtual tour image davis california bodega marine lab bay health sacramento tahoe envi,aman
https://indexmundi.com,blog search oiai current world population already passed billion mark clock shows estimate based un numbers view index mundi contains detailed country statistics charts maps compiled multiple sources explore analyze thousands indicators organized region country topic industry sector type sectors commodities exchange rates agriculture energy mining trade charts comparative rankings comparisons historical spotlight compare countries,aman
https://fileinfo.com,main file informasi types software help center settings infocom format database search ioooo extensions programs advanced submit type drag drop upload view details today september xlsx microsoft excel spreadsheet xlsx created exported another program open office calc apple numbers stores worksheets contain cells arranged grid rows columns may also charts mathematical functions styles formatting cab windows cabinet cab archi,aman
https://usf.edu,give usf academics admissions locations campus life research students faculty staff alumni parents family directory find major search undergraduate majors offered usf estimate cost review tuition financial aid scholarship opportunities apply start application become bull visit view maps virtual tours get directions aau membership bring extraordinary benefits historic invitation provide new federal funding opportunities research strengthen role meet,aman
https://pitt.edu,main academics admissions research life pitt athletics open search future lives explore community impact health wellness technology science arts humanities diversity equity inclusion global engagement innovation cityour campus learn pittwire alumni competed indianapolis motor speedway among competing checkered flag august countrys top auto racing bodies indy car nascar held separate races annual eardrumrattling brick,aman
https://higheredjobs.com,main sign job search account news resources employers jobs institutions new today category administrative faculty executive location metroregion stateprovince country onlineremote school fouryear twoyear type dual career todays adjunctparttime advanced advice sustainability higher edisi bagus environment campus september novels enjoy dive semester author residence myth vs reality returning create free edisi join,aman
https://education-portal.com,teachers schools working scholars college credit sign plans subjects courses test prep teach tutoring learn faster stay motivated study smarter improving grades fun easy simple videos experts stepbystep homework help anytime anywhere select subject grade identify strengths weaknesses focus need ace test exam earn lowcost transfer school choice save tuition graduate plan lessons effectively engaging videos class,aman
https://caltech.edu,main covidi information visit careers quick links click open quick links submenu directory caltech today alumni give joy discovery convocation welcomes new students campus september laurie leshin ms ph di director jet propulsion laboratory delivered keynote address undergraduate graduate passionate pursuit discovery read full article know science exchange explores history impact part earthquake country alliance runs shake,aman
https://uci.edu,main uci homepage toggle dropdown admissions academics research community give search web people home top buzz news visit events arts athletics initiatives health alumni giving resources partnering advance latino students highlights ucioc alliance hispanic heritage podcast whats business dean ian williamson discusses trends shaping future work advancing inclusive excellence dyonne bergeron ucis new chief diversity officer plans build,aman
https://unt.edu,main find passion unt search enrollment soars nearly aooo students top choice career readiness texas largestever student body enrolled fall semester university north texas growth comes firsttimeincollege freshmen graduate students studying frisco universitys campus serving collin county apply read unts record numbers aao total eiao frisco unt bachelors degrees choose excel teachers artists,aman
https://enchantedlearning.com,sign print page home site index whats new free sample pages subscribe enchanted learningcom usersupported site members full adfree printfriendly version click learn learning est online curriculum material aoooo web iooooo subscriptions share page learning glance jump right educational resources make fun start browsing aoooo worksheetsprintouts crafts activities much use without account covers,aman
https://umn.edu,main wordmark university minnesota twin cities crookston duluth morris rochester utility incident information kamu henti jobs search navigation academics admissions student life research health sciences gopher athletics news events minnesota campus bold minds dont wait discover cities visit apply request iooos internship opportunities undergraduate majors graduate professional degrees endless discovery major every interest faculty read,aman
https://utk.edu,request informasi visit apply give search academics admissions diversity research outreach find place rocky top today theres something everyone ut cant wait call campus home sweet home areas study life financial aid scholarships university tennessee knoxville tennessee volunteers terang way others create path love working alongside expert faculty supportive atmosphere emphasizing handson servicelearning explore majors,aman
https://oregonstate.edu,main search oregon state university beaver nation oregons best public research nearly degree programs path career future always wanted find major computer science universitiescom agriculture forestry world center rankings locations corvallis osucascades online extension service hatfield marine osu portland states beautiful historic stateoftheart campus located americas college towns nestled heart willamette valley,aman
https://ucsb.edu,main university california santa barbara give quick links navigation applying academics research campus experience uc land meets sea brilliant minds meet academic excellence social engagement unite spark creativity discovery news events heres whats happening around campus breaking magazine springsummer issue interdisciplinary researchers confront lifes challenging medical conditions literature poetry honoring,aman
https://edx.org,main toggle mobile submit search query edisi asked ceos answered ais impact workplace read close site banner fuel ambition explore courses recognized innovation careerrelevant learning scroll carousel forward see partners learn leading institutions new executive education masters degrees bachelors popular digital transformation sustainability leadership interpersonal skills business management strategy science analysis artifici,aman
https://uchicago.edu,news events careers informasi visit contact give directory education research life uchicago admissions medicine covid learn apply campus latest community welcomes new students source christopher wild aims address september breaks ground states first freestanding cancer center university chicago forum free inquiry expression launch oct see breakthrough discoveries ideas come explore tomorrow began value rigorous diversity,aman
https://umass.edu,use personalize provide social media features analyze traffic also share information site media advertising analytics partners review privacy policy learn informasi main bold true whats like attend umass student tour guides offer glimpse typical lives umass amherst chancellor reyes makes history welcoming students back campus javier embarked tenure leader massachusetts flag,aman
https://englishclub.com,learn teach books ec new join forum grammar vocabulary pronunciation listening speaking reading writing guest secrets easy englishcom quizme teflnet english club helping click pages tpdiscussion tphomework esl learners listenlearn lessons parts speech verbs nouns adjectives adverbs sentences topic vocabulary reference word class stress sentence linking listen learn radio dictation greetings presentations telephone test short stories exercises alphabet punctuation plag,aman
https://cam.ac.uk,choices little files save device remember preferences use necessary make site work usage measurement analyse anonymised patterns websites better may choose optin optional personalisation social marketing give information settings allow tailor experience preferences things like measure view media website using thirdparty services main search black atlantic uncovered bringing together collections f,aman
https://cmu.edu,carnegie mellon university search academics admission visit research student experience athletics give spotlight story cmu experts brief policymakers transformative innovations artificial intelligence read recommendations news indepth celebrating years dietrich foundation support take look gifts extraordinary impact recent dean demonstrates could advance sdgs un briefing answers cmus rayid ghani testifies senate committee mourns trustee lowell steinbrenner,aman
https://ubc.ca,main university british columbia ubc search campuses admissions academics strategic priorities research campus life news give prospective students undergraduate graduate faculty staff alumni community partners spotlight whats oranye shirt find events wellness resources announces schulich leaders receive canadas largest stem scholarship recognizing outstanding members presidents awards announced connect explore community art stre,aman
https://ucr.edu,listing campus map find people news search quicklinks uc riverside university california academics admissions research life information give lights camera action ucr magazine summer bold hearts brilliant minds wont take classesyoull action powered great education worldleading research knowledgedriven impact students transforming nation world ucr tapestry trailblazersfrom first generation globally recognized researchersbringing tog,aman
https://english-test.net,bad gateway,aman
https://flvs.net,contact careers select language english spanish creole follow passions nomor classroom required find online courses excite support need crush way timebecause know learning goes beyond classroom enrollment open individual courses full time public school opens october second semester explore education highlights students choose wide variety course catalog years leading since served overv,aman
https://uwaterloo.ca,main footer university waterloo admissions faculties academics offices services support search pause slideshow information change panels tab select first panel hitam future students current faculty staff alumni employers tours events register upcoming learn programs applying coop et cetera undergraduate programs view admission requirements high school transfer graduate studies discover masters doctoral go pathway facts computer science engineering mathema,aman
https://sfsu.edu,main san francisco state university calendar search sf button navigation academics admission aid student success life faculty staff alumni give quicklinks expand home spring applications open get involved news awarded gold rating campus sustainability gator juan gonzales reflects years mission community newspaper leaders finance magazine publishing education music film named hall fame inductees siapa ge international business certificate,aman
https://mathxl.com,math xl improving results goal help every student succeed working educators institutions improve students everywhere learn sign already registered pearson account forgot username password lab mathmy statistics users register need start educator see delivers measurable personalize learning time today reaching feel reach mastering connect meaningfully even distance built flexibility digital plat,aman
https://alison.com,alisons new app available os android download explore courses lms sign learn get certificates build career earn alison free online diplomas want today million learners graduates countries aooo ioao health language eoo business iai management personal development sales marketing engineering construction teaching academics english people learning today sure begin main goal alison popular top worlds leading exp,aman
https://cprogramming.com,starting begin get book tutorials tutorial game programming graphics algorithms practice problems quizzes resources source code tips getting compiler recommendations forum references function reference syntax frequently asked questions learn cprogrammingcom covers indepth beginnerfriendly tutorials advanced articles jumping highly reviewed friendly introduction started new programming start read go beginner expert book deeper make ga,aman
https://utah.gov,utahgov official website services government business employment education visit residents support search outdoor person self employed parenting teens moving utah turning featured vehicle renewal state tax commission hunting fishing division wildlife driver license jobs department workforce vital records health view latest news usu extension host remote teams summit park city published tue aug designed professionals manage fully hybrid autu,aman
https://buffalo.edu,university buffalo state new york ub glance academics research life admissions search informasi apply give happening awards recognition rises nomor among public universities latest news rankings ranked second flagships economic diversity technology innovation tool bagus suny chancellor says leading way student experience south campus hit students check video see snapshot true blue start season theyre addicted opiates without aware,aman
https://iastate.edu,toggle future making see iowa state experience university community loyal forever true large small feel forge lifelong friendships earn degree take anywhere unearth full potential learning find builtin social academic support network makes transition college life easier communities firstyear students participate least play video innovate state means feeling inspired try something new built likeminded friends faculty,aman
https://ucl.ac.uk,ucl home prospective students current staff businesses alumni donors search londons global university disruptive thinking since find tackling challenge dementia world alzheimers professor jonathan schott ucls collaborative approach neurology chief medical officer research uk dari cath mummery using gene silencing treatments tackle leading worldfirst trial involving gene silencing drug disease nick fox need support rare dementias coleads support,aman
https://bukisa.com,home adventures planet people animals bride loses pounds wedding surprise groom losing weight never easy shedding requires lot dedication effort thats bridie ritchie groom question angie ray published iiaoi mindblowing safari pictures thatll leave breathless comes choosing vacation destination actually prefer cooling white sandy beach relaxing star luxury hotel however others ad,aman
https://englishforums.com,teachers students forums news blog join live chat english forward questions currently answered minutes webs largest learn english community qa site ask new questionor search question exists popular ielts task graph shows changes share vehicle registrations common types commercial vehicles edgar quynh please review essay topic finding job satisfaction considered luxury many developing countries think teechr,aman
https://webassign.net,web assign contact enter class key sign catalog instructors students support lms integration update fall youll able push button send gradebook unattempted student work assign get details iea create path success flexibility every step build confidence problemsolving criticalthinking skills customizing learning experience explore features right time enable deeper expertly designed well researched timetested learn improved thr,aman
https://cengage.com,support contact students instructors gale elt cart getting started asia edition digital solution catalog chinese learning accelerate life find mindtap effect amazed impact inspired teaching confident learning change mindset accessibility cengage sites site map terms conditions privacy piracy asia benar reserved,aman
https://venture-lab.org,home business science tech education contact businessapril pandemic people masih struggling money heres study tipsmarch smarter harder effective techniques students try scholorshipsmarch tips prepare scholarship interview successfully applied scholarship chances techmarch sense rapid application development latest businessdecember signage broker wherever live operate nomo,aman
https://learn4good.com,bagus things happen daily contact college admissions usa nj ca lah sf bay area tx fl il mi oh tidak uk london school inquiry forms search study abroad programs italy spain europe canada learn english spanish classes nyc free job posting sites schools colleges universities online edu languages toefl tefl jobs visas games advertise jobs country albania algeria andorra angola argentina armenia australia austria azerbaijan bahrain bangladesh belarus belgium benin bosnia herzegovina botswan,aman
https://cambridge.org,main products services careers breadcrumb home homepage cambridge university press assessment qualifications assessments academic publications original research spread knowledge spark curiosity aid understanding around world find english engage inspire millions people throughout language learning journey help confidently prove skills learn transforming societies education partner governments world improve qual,aman
https://capella.edu,main section view commitment accessibility request information email degrees programs capella experience financing admissions apply education defined flexibility earn degree online terms reshaping higher fit life see learning formats could help make difference career find program bachelors masters doctoral certificate alumni agree provided needed pursue degree outcomes survey oio choose path learn demand set deadlines u,aman
https://ualberta.ca,main admissions programs colleges faculties research services kamu university strategic plan launched help shape experience see shape impact guide decade community event september learn days study top canadian world find makes student rich meaningful lifechanging explore digital viewbook undergraduate studies journey starts choose program options check admission require,aman
https://schoolloop.com,website stores computer used improve provide personalized services media find use see privacy policies wont track information visit site order comply preferences well use tiny youre asked make choice accept decline software goes thrive decide create place thrive like businesses depends variety solutions sales infrastruct,aman
https://unsw.edu.au,study research faculties engage news events unsw alumni giving contact follow sex life deserve sextember unsws annual sexual health festival celebrating things sex relationships back inperson online explore september see whats go sextember website made amazing connections owe many professional wins thomas houlden economics researcher future starts enquire apply latest stories megan davis geor,aman
https://byu.edu,byu learning suite search admissions aid academics campus life becoming inauguration shane reese iath president brigham young university week marked formal induction presidency also unveiled commitment help fully reach prophesied potential apply athletics academic calendar canvas highlighted events midnight madness friday september flu shot clinic forum akhil reed amar tuesday full news intellect educators native american tribal leaders team u,aman
https://uiuc.edu,university illinois urbanachampaign campus directory map library give students faculty staff alumni parents admissions academics research diversity outreach international arts culture athletics home homepage feature stories news insights top scientists engineers choose startups tech behemoths reasons money legacy failed effort bring gray squirrels ioi tube actively direct users toward antivaccine covidi professor labor emp,aman
https://alaska.edu,ua quick links uaf uaa uas empower alaska university visit site home campuses admissions alumni donate system covidi information prospective students degrees programs study options programs cost attendance find attendance room board tuition fees apply admission process applications workforce development explore training career services discover universities across featured campaigns teach nationally accredited state approved teacher educ,aman
https://www.google.com,gmail google image available english basa bali indonesia advertising business search works privacy terms settings,aman
https://www.bing.com,chat images videos maps news indonesia sign rewards anywhere anytime get gpta free download bing app later introducing new ask real questions complete answers learn inside nobel peace centre oslo norway ilyas ayubalamy informasi privacy legal advertise help feedback,aman
https://id.search.yahoo.com,yahoo west java settings good evening today september help privacy terms dashboard,aman
https://blog.kejarcita.id/cara-tepat-penerapan-sex-education-untuk-siswa-sd,"subscribe newsletter, get latest posts sent straight inbox, Miela Baisuni, freelance writer, social media specialist traveler, recommended you, tens thousands free questions discussions homeschooling, available various formats, online quizzes, quiz links, files printouts, oioi pt printouts memorandum pursuing goals, hots material services, teaching packages company profiles, getting know career blog team, terms privacy provider",aman
https://hellosehat.com/parenting/remaja/tumbuh-kembang-remaja/edukasi-seks-anak,"category health check booking community doctor enter parenting teenagers growth development guide providing sex education teenagers it. parents consider trivial taboo teenagers even though sexual education start early, method teenagers actually same. Quoted journal american academy pediatrics children need receive accurate sexuality necessary know",aman
https://tirto.id/contoh-materi-pendidikan-seks-anak-di-usia-dini-manfaatnya-gbps,"browse current general election mild report current issue home sex education schools fotoholly andres writer maria ulfa tirtoid mar wib updated jan read normal minutes yet specifically implemented schools parents' initiative give children considered important early childhood becomes important considering many cases occur community regarding acts sexual violence children, field actually apathetic lacking",aman
https://maglearning.id/2021/07/26/materi-ipa-smp-kelas-9-organ-reproduksi-pada-laki-laki,"maglearningid learn fun home education learning media statistical research methods tips tricks junior high school science material class reproductive organs men comments part subchapter structure function human system humans consist several organs including external penis functions urinary tract sperm urine scrotum like sac testicles, maintaining temperature testicles suitable production. ovoid shape stored",aman
https://raisingchildren.net.au/school-age/development/sexual-development/sex-education-children,navigation search pregnancy grownups babies children teens autism disability sexual development suitable years sex education talking sex share found helpful key points early conversations send message sexuality healthy parts life important feel coming reliable honest information young might want know bodies come explain things level understand make sure facts page steps talk sex bodies tips,aman
https://www.todaysparent.com/family/parenting/age-by-age-guide-to-talking-to-kids-about-sex/,getting pregnant pregnancy baby family product reviews recipes newsletters tween teen talk kids sex agebyage guide talking kid sex daunting asked experts cover everything puberty gender identity consent lindsay kneteman updated mar photo stockphoto years ago lisa king first daughter sixyearold nephew became fascinated growing belly hed ask get inside tummy going king left inquiries nephe,aman
https://raisingchildren.net.au/pre-teens/development/puberty-sexual-development/sex-education,navigation search pregnancy grownups babies children teens autism disability puberty sexual development suitable years sex education talking sex share found helpful key points early conversations send message sexuality healthy parts life important feel coming reliable honest information aged might want know made masturbation explain things level understand make sure facts page children,aman
https://www.unja.ac.id/pentingnya-pendidikan-seks-pada-anak-usia-dini-di-era-digital/,"news academic research unja acceptance student links, importance sex education early childhood digital era Dewi Rahayu Nim Paiioo, Master Technology Postgraduate Program, Jambi University, sexual violence recent years become increasingly common, making sad parents, educators educational practitioners this. definitely impact child's future. Covid-19 pandemic, perpetrator likely caused parenting patterns",aman
https://www.idntimes.com/life/family/mely-rovina-farizal/cara-mengenalkan-sex-education-pendidikan-seks-kepada-anak-c1c2,join IDN Times Quiz News Business Sport Tech Hype Korea Life Health Community Regional Popular Topics Pulau Rempang Presidential Candidate Sleep Call Air Pollution Anies Baswedan Ganjar Pranowo Prabowo Subianto Home Family introduce early sex education children Sep Ieo Prevention better cure huffingtonpostcouk writer mely rovina share facebook twitter rise cases violence minors causing concern parents sexual violence occurs,aman
