url,text,status
https://wiktionary.org,wiktionary free dictionary english ooo entries русский статье español entradas français entrées ελληνικά λήμματα deutsch einträge polski haseł bahasa indonesia entri 中文 词条 詞條 italiano lemmi search català čeština eesti esperanto farsi 한국어 한국어 하다 ido kananada kurdī kurdī lietuvių limburgs magyar malagasy malayala nederlands 日本語norsk bokmål одає oʻzbekcha ўzbekcha português română saraiki srpski srpski srpskohrvatski srpskohrvatski suomi svenska tamaớa talaga ภาษาไทย türkçe tiếng việt հարան,aman
https://shmoop.com,use provide improve services using site consent learn accept sign choose adventure students start studying teachers let help parents get answers schools districts explore shmoop used ioooooooo make learning easier humours bone humor break tough subjects fun ones fun yet rigorous built memorization focus retention relatable iooos videos guides mean reading never fun cool tools test,aman
https://forvo.com,find perfect personal trainer english pronunciation buscar listened learn speak forvo language want wherever book trial lesson choose teachers world receive targeted sessions spanish lessons french german italian portuguese russian forvo individual sessions personalised study plans according interests goals flexible scheduling pace whenever native guaranteed quality training allinone everything need dashboard verified professio,aman
https://teacherspayteachers.com,join grades subjects tpt extraordinary teachers share innovative ideas explore elementary school resources morphology activities prefixes suffixes roots early readers emily gibbons literacy nest original price rated based reviews mindfulness daily classroom slides timers teach create motivate ela fast finishers choice boards erd ath grade begitu little ladybug shop factors multiples prime composite numbers math,aman
https://craftsy.com,browse resources search tune live events favorite instructors join craftsy studios interactive qa sessions instructors get direct answers crafting questions straight experts view quilt sew knit cake cook classes shop dvds new arrivals popular explore category quilting sewing knitting decorating cooking sign newsletter stay connected email footer logo svgvstopnavlogo pathfillfff making lives better creativity facebo,aman
https://chronicle.com,featured ascendium resource center future advising professional development faculty register free account subscribe sign news advice review current issue virtual events store jobs show search advertisement advantage affirmative action legacy admissions early decision go practice favors wealthy white students colleges sayang helps plan ahead recruit loyal students wake forest kamu offer earlyadmission option firstgen,aman
https://asu.edu,asu websites use enhance user experience analyze site usage assist outreach enrollment continuing site giving consent learn privacy statement agree arizona state university repeatedly ranked news world report released annual rankings ninth row innovative ahead mit stanford far nomor ranking recognition sun devils strive excellence every endeavor,aman
https://thinkexist.com,private attackers might trying steal information thinkexistcom example passwords messages credit cards learn neterr_cert_common_name_invalid get chromes highest level security turn enhanced protection back safety advanced,aman
https://quotationspage.com,private attackers might trying steal information quotationspagecom example passwords messages credit cards learn neterr_cert_authority_invalid get chromes highest level security turn enhanced protection back safety advanced,aman
https://discoveryeducation.com,open daily learning platform giving educators innovative ways design deliver engaging experiences every check latest updates featured blog adik hispanic heritage celebrate september october recognizing many contributions cultures stories latin american communities classroom success story creating stronger community virtual field trips read verona area school district uses discovery educations create opportunities,aman
https://webopedia.com,definitions insights reference topics type search term online tech dictionary students educators professionals looking definition terms scala hosting read development hris best managed service providers computer science computers artificial intelligence wideranging branch hypervisor hypervisor also known virtual machine motor virtualizer languages sql sql standardized query language requesting information go section securit,aman
https://colorado.edu,search main home academics admissions research visit secondary students faculty staff families alumni prepared supported successful cu boulder help buffs succeed classroom offer advising resources achieve academic personal career goals top questions ask adviser campus highlights free wellness activities try graduate ph di get published computer science student also international frisbee dog competi,aman
https://uga.edu,students faculty staff alumni community directory search powering excellence tomorrows leaders creating todays impact uga helping develop innovative solutions precision agriculture machine learning bioinformatics learn discover georgias flagship institution higher education browse degrees distinct schools colleges prepare future plan visit experience ugas historic campus university news read niche top public universities school financia,aman
https://enotes.com,select area website search study guides homework help lesson plans site page citation start essay iconquestion ask question join sign learn book question weve summarized analyzed every book syllabus macbeth great gatsby obscure works higher level courses indepth factchecked team experts understand story chapter theme character popular new updated kill mockingbird harper lee william shakespeare romeo juliet hamlet go slide,aman
https://busuu.com,Get Busuu Premium Unlock New Language Superpowers English Spanish Japanese French German Spanish Italian French Portuguese Turkish Arabic Polish German Costa Rican日本語 中文 한국어 tiếng việt bahasa indonesia,aman
https://funtrivia.com,fun trivia sections services new player free click join trivia thousands games quizzes lots world quizzes updated daily since questions quick pub packs play educational parents teachers students games hourly email crossword puzzles play surprise everyone loves surprise whats players playing activity feed topics ios american football animals baseball bible kids brain teasers celebrities christmas comics disney mixture entertainment food drink general,aman
https://wiziq.com,contact request demo become partner features integrations solutions pricing get easytouse affordable virtual classroom lms software online course creation tests assessments commerce learning analytics need deliver tools teach train students customers partners image create sell courses leverage wiz iq interactive consumed selfpaced live classes take tutoring deploy operations expand new markets minimum investment moocs easily reach enroll students fr,aman
https://jhu.edu,video footage swift zoom shot campus breezeway treelined quad beyond students white lab coats work atur closeup student examining culture petri dish together mechanical engineering challenge blue ball dangling string exterior johns hopkins carey business school sunny boats baltimores iconic domino sugar plant visible background man works laptop writes notes notebook waters harbor window behind wearing ripped jeans opens door enter fast forward kamu c,aman
https://upenn.edu,main go site search primary navigation resources clsi fill cls clse penn home academics admissions aid athletics research innovation life toggle give arts humanities social sciences climate week highlights links biodiversity crisis topics news announcements message campus community numbers undergraduates share pz project childrens young adult literature rise health medicines carl june receive breakthrough prize filmmaker mira nai,aman
https://virginia.edu,main university virginia kakak perempuan uvacanvas email jobs informasi academics admission arts athletics health system libraries research student affairs community bridges register glance give mcintire million donation darden nomor business school discovery heart failure prevention population metro vs rural growth faculty spotlight cure burnout dari petri get revolutionary new vaccines covidi rsv news meet uvas whirlwind matchmaker government,aman
https://ets.org,main footer journey whats possible select path begin find right test show english ability gain teaching license qualified applicants view featured research equity time skill transforming educational measurement read get latest ets connect follow careers contact disabilities diversity equity inclusion belonging news insights solutions educator licensure higher education ki student programs products gre praxis,aman
https://udemy.com,categories search anything teach udemy sign english bahasa indonesia skills sale chart path success limitedtime savings latest topics trusted iaaoo companies millions learners around world broad selection courses choose ioooo online video new additions published every python excel web development java script science amazon awas drawing expand career opportunities take udemys range learn code using incredibly useful lan,aman
https://proprofs.com,delightfully smart tools products blog contact believe software make bahagia smarter employees happier customers training maker lms train anywhere anytime knowledge base help center manuals shared quiz worlds simplest way create quizzes collaborate build qa forum learning community project track projects tasks time desk complete ticketing chat center survey surveys forms nps live support realtime qualaroo insights visitors context website app bigco,aman
https://oxforddictionaries.com,research products dictionaries contact discover language could power social copyright oxford university press benar reserved policy privacy legal notice use enhance experience website website uses provide targeted advertising track clicking continue continuing website agreeing change settings time find see continue,aman
https://liberty.edu,main navigation online residential athletics alumni parents request informasi apply visit create guest account sign edu_stacked_logo magnifying_glass_icon academic calendar library luoa ki chat give academics degrees admissions tuition faith service campus life liberty slideshow_arror affiliated websites information aea ooo get started today start journey questions answered schedule tour ready explore liberty choose event opportunity right yo,aman
https://northwestern.edu,students parents families alumni faculty staff media quick links academic calendar caesar canvas directory libraries webmail academics admissions campus experience research giving new high funding northwestern hits billion milestone strength continued growth ecosystem excellence read people northwestern students alumni create definitions success meet places bordered great lake global city offers best worlds explore highlights events fro,aman
https://nd.edu,university notre dame academics admissions research global faith service campus life visit give alumni athletics picture drought nd ecologist matching national aeronautics space administration images field measure forest health read story conversation justice elena kagan supreme court associate friday september community rolling mat decades making dames vision dense walkable college town adjacent finally reality dames faculty fulbrig,aman
https://rutgers.edu,main breaking news rutgers makes recordbreaking gains rankings read new brunswick newark camden rbhshealth apply informasi events giving open search experience academics research health patient care admissions tuition home great places visit students share advice incoming class top public university nation information current fall career internship mega fair meet overview big picture rutgers state jersey academic health powerhousewi,aman
https://arizona.edu,main search resources select audience choose option future student current faculty staff member parent visitor alumni donor business partner go page group visit apply navigation admissions academics research life news give athletics pause video play become wildcat university arizona accepting applications fall explore requirements deadlines majors financial aid start application find home undergraduate majors graduate,aman
https://edublogs.org,schools districts sign blogs websites education educators educators oldest trusted web publishing platform teachers students get free blog plans pricing blogs websites portfolio networks edublogs forever igb storage student management adfree safe themes plugins profesional per usd ogb allow search engines complete visitor statistics email subscriptions upgrade campus press custom unlimited single domains choose local center campuspr,aman
https://unc.edu,main top level navigation discover navigate search support expertise aid ncs opioid response read work done carolina faculty visit support apply covidi resources facebook twitter tube instagram pinterest home accessibility alert alumni connect campus map contact careers departments ethics integrity media libraries people directory privacy statement unc student stores well university north chapel hill,aman
https://desire2learn.com,help people achieve ever imagined nomor matter teach dl empowers technology services take results level lets talk get started great organizations think alike see toronto canada jul fusion preregister create learning moment connect community peers partners experts discover latest trends product updates best practices share goals answers toughest questions grow skills explore topics ondem,aman
https://umd.edu,main search inside umd news events admissions support tube facebook twitter instagram preeminent public research university celebrating excellence ranks nomor among schools jumps spots overall read maryland covidi information updates guidelines resources community learning living working safely campus find latest updates maryland college park states flagship nations universities global leader research entrepreneurship innovation home,aman
https://macmillandictionary.com,home english macmillan education customer support filter popular titles navio mind series nd edition open breakthrough plus teacher app student gateway company give academy stars optimise campus onestopenglish language hub global stage skillful share doodle town world get involved bahagia campers everywhere ready first ath ci advanced show policies policy privacy terms use quick links international offices benar permissions teaching resources,aman
https://studyisland.com,website stores enable essential site functionality well marketing personalization analytics remaining website indicate consent privacy policy main back school toolkit get quote support solutions products services resources change location boost standards mastery proficiency students use standardsbased formative assessment practice program achieve higher math reading scores limited time offering,aman
https://phrases.org.uk,phrases sayings idioms expressions phrase finder search english idioms phrases proverbs use every meanings origins explained browse beginning di ke dan uv xyz full list popular today bagus turn deserves another wish toodleoo throw towel usual suspects sledgehammer crack nut thesaurus writers resource stimulates ideas headlines copy song lyrics fiction writing et cetera find know understand language like,aman
https://vanderbilt.edu,vanderbilt university founded commemorating people places programs make rich history experience years dare grow explore campaign drive bold levels growth quick guide prospective undergrads grad professional current students faculty staff job seekers alumni friends undergraduate admissions financial aid scholarships academics find major schools colleges student life plan visit research athletics anchor city nashville diversity inclusion,aman
https://ucf.edu,main search ucf academics admissions research locations student life alumni giving athletics apply unleashes potential nationally recognized believe power people ideas produce lifechanging research innovative learning economic success students thats news world report ranks among best colleges nation impacting expert faculty explore top innovation degree programs colleges provides education future today find program,aman
https://hawaii.edu,home directory uh work apply twitter facebook instagram youtube linked flickr rss campuses dropdown attend system strategic plan across hawaiian islands news president lassner announces plans retire announced message board regents september offers full scholarships lahainaluna class looks support survivors maui wildfires providing high school students breast cancer improving survival treatment rural patients shidler dean roley named ha,aman
https://cuny.edu,academics admissions financial aid research apply dream starts fall semester cuny transfer reenroll latest simply best schools named among best colleges princeton review lauded outstanding overall quality value cuny lifting new york university unveils plan expand enhance student success increase impact engine upward social civic mobility back opens promising academic newly appointed fulltime facu,aman
https://tamu.edu,navigation search texas university featured links majors graduate professional programs tuition costs financial aid corps cadets veterans maps howdy portal news sporadic rainfall brings relief parts ukrainian ambassador says conflict russia implications across world texas today season premieres september kamutv pbs online spotlight aggiebound ith man learn everything know ams storied tradition man aggie traditions camp,aman
https://quotegarden.com,quote garden dig old books est contact terms use privacy policy special note hai friends taking temporary leave absence work tending personal matters quotations remain online time however search feature read holidays occasions bagus sentiments admin asst anniversary april fools armed forces baby adoption back school birthday black friday shopping history boss carfree christmas dare great daylight saving time,aman
https://duke.edu,main students faculty staff alumni duke university admissions academics research global arts schools institutes search health libraries giving athletics workingduke farm bill matters experts share key piece legislation may affect climate change plants tell joins week new york highlighting partnerships robert lefkowitzs years discovery decades work environmental justice news today birthing black mothers jennifer,aman
https://princeton.edu,main princeton university search opening exercises president eisgruber invited princetons class think critically embrace generously service humanity preread assembly nobel peace prize winner maria ressa inspired confront disinformation threatens democracy embracing free expression orientation program aclus romero explored navigate challenging speech difficult conversations news view names campus arch kentaro ikeda aa u,aman
https://commonapp.org,future starts apply college first time transfer complete degree navigate entire application journey common app start explore iooo colleges app search filter optional accepts firstyear applications public private small ooo medium ooi large iooo rural suburban urban hbcu hispanicserving institution view world ready world reach higher united inspire people education future nomor matter holds get valuable,aman
https://uiowa.edu,main university iowa top links apply visit request informasi search site navigation admissions academics research student life athletics alumni giving health care home play start story virtual tour areas study cost aid hawkeye great stories begin time find information hear hawkeyes meet students right choice communication skills grown much since coming iowa city geared towards,aman
https://gmu.edu,george mason university apply give mymason patriotweb peoplefinder athletics news calendar library graduation academics admissions aid research student life previous linguistics scholar designs mysteries congress drew keyvnne dimaano mason schools virginia program would lead speaking mandarin writing rebuses competitive summer internship congress photo evan cantwellgeorge read keyvnnes hear students chose,aman
https://collegeconfidential.com,sign real deal applying college information eoo colleges universities planning tools vibrant online community guide college experience dreams get started im student im parent caregiver work confidential million forum posts across thousands topics related selection chances admission campus life answers questions indepth university profiles provide admission stats plus valuable informasi life academics cost explore schools ioooo art,aman
https://synonym.com,synonymcom new word condensation synonym anyway synonyms antonyms noun ˌkɑːndənˈseɪʃən psychoanalysis unconscious process whereby ideas images combine single symbol especially dreams shortened version written work summary abridgment sumup abridgement result becoming smaller pressed together coarctation constriction shrinkage compression shrinking atmospheric moisture condensed cold phenomenon condensate dew act increasing density something inspis,aman
https://raz-kids.com,products order free trial razkids member resources manage students kids awardwinning website go read anytime anywhere get samples start new razkids watch quick video introduction overview leveled reading benefits mobile apps delivers hundreds interactive books spanning levels aoo openbook quizzes added every even spanish corresponding quizzes test comprehension providing teachers skill reports datadriven instruction online running rec,aman
https://wustl.edu,search footer wu physicians directory applyvisitgive academics research campus experience open survey popup help improve redesigning website would value feedback please complete iominute share site take close prospective students current parents families faculty staff alumni friends washington university louis community individual achieve exceptional things committed learning exploration discovery impact research,aman
https://gatech.edu,main navigation keyboard academics admissions campus life athletics research news events user account apply transform tomorrow give today open search ethics concerns experts debating decisionmaking algorithms gone science labs scifi movies everyday use homes justin biddle shares pressing concerns first steps take address august photos distilling outdated software could save defense dept millions time money,aman
https://wikiquote.org,wikiquote free quote compendium english ooo articles русский статей italian voci türkçe maddeler polish articles arabic articles עברית דפים spanish articles german article українсь ка search azərbaycanca български bosanski català eesti ελληνικά esperanto farsi français chinese bahasa indonesia lietuvių limburg magyar nederlands 日本語 norsk n ynorsk português dictionary Slovenia Slovenia Spanish Srpski Basa Sunda Suomi Svenska 中文 аայերեն read language commons freely usable,aman
https://babbel.com,babbel businesses sign language want speak spanish french german italian million subscriptions sold difference method explore new learn everything need real world conversations vocab words culture minutes takes appbased lessons created team expert teachers designed levels learners ways live online classes babbel live original podcasts games videos theres always something discover subscription options get,aman
https://c-sharpcorner.com,technologies answers jobs books events interviews live sign post ask question latest videos upcoming sep thu iop minutes better selling podcast ep register sun ioeoa exploring technology batticaloa oct rockin code world dot net dave ft dylan beattie recent posts auto cancel long running pipelines synapse azure factory nandan hegde articles harus min ago kafka mere mortals topics partitions practice tural suleymani python inside net iron ajay,aman
https://gsu.edu,private attackers might trying steal information gsuedu example passwords messages credit cards learn neterr_cert_date_invalid get chromes highest level security turn enhanced protection back safety advanced,aman
https://cliffsnotes.com,literature notes test prep study guides sign explore study review cliffs original widely imitated guide featured lit hundreds titles get ready trend high school college grad professional unbroken anatomy physiology gmat asvab hamlet biology gre praxis wild differential equations dat ftce great gatsby accounting exam format nclexpn kill mockingbird sociology lsat teacher resources need help preparing test youve come right place,aman
https://wordhippo.com,whats another word synonyms antonyms definitions rhymes sentences translations find words forms pronunciations opposite meaning translate english friends scrabble crossword codeword starting ending containing exactly letters pronounce conjugations thesaurus tools creative needs finders helpers apps nouns verbs adjectives adverbs plural singular past tense present unscrambler os apple android home terms use privacy statement di ke dan kamu ya copyrig,aman
https://thinkquest.org,site cant reached thinkquestorg took long respond try checking proxy firewall running windows network diagnostics err_connection_timed_out reload details,aman
