url,text,status
https://wikipedia.org,wikipedia free encyclopedia english ooo articles free english spanish articles deutsch article francais italiano voci free encyclopedia portuguese artigos arabic article ة search afrikaans polski asturianu azərbaycanca bol белгарски bol беларуская català čeština cymraeg dansk eesti esperanto euskara farsi galego 한국어 hand hrvatski ba speaks indonesia Latin Latvian Lietuvių Magyar Egyptian Melayu Bahaso Minangkabau Nederlands Norwegian Bokmål Nynorsk нохчийн Oʻzbekcha ўзбекч,aman
https://thefreedictionary.com,dictionary encyclopedia thesaurus free dictionary ieoo visits served google keyboard word article starts ends text register sign click facebook twitter share tools worlds comprehensive dictionary english spanish german french italian chinese portuguese dutch norwegian greek arabic polish turkish russian thesaurus medical legal financial dictionaries acronyms abbreviations idioms encyclopedia literature reference library search engine thursday september vie,aman
https://khanacademy.org,main courses search get guide donate sign help well right point asking support kan academy nonprofit relies people like everyone reading gives monthly academy continue thrive years please keep free anyone anywhere forever select gift frequency time recurring monthly yearly amount dollars donating agree terms service privacy policy every student classroom real results missi,aman
https://reference.com,site logo referencecom whats question history geography world view science technology business finance pets animals submit button image thumbnail regus boost productivity todays world key success heres help top benefits buying ge appliances find best dishwasher needs shop rooms go bedroom furniture tips maximize corel draw plan perfect viator tour every occasion get dell personal computer pick right computer hughes net home,aman
https://urbandictionary.com,browse store blog discord advertise renoviction act evicting tenants rental houses apartments greedy landlords announce huge renovation plans require emptying units renovated allowed renew leases agree rent increases sometimes double paid portmanteau word combination eviction invented heather pawsey vancouver canada got notice today new building owner theyre going divide living room make bedroom replace ki,aman
https://lynda.com,learning linked start free trial sign keep moments matter expertled courses across variety online class topics every step career instructors realworld experience buy team explore business technology creative trend em morning habits high performers course eeai viewers ih excel lookup functions depth iii ah electronics foundations basic circuits personal branding excel visualization mastering charts graphs find right choose,aman
https://m-w.com,encyclopædia britannica company games quizzes word grammar wordplay finder new challenges every play september regimen get definition examples podcast inbox top lookups right refresh seconds mitt beaker scooter listeriosis desolate loathsome synonym dog chronic meek view challenging standardized test words questions help score pop culture vocab quiz embiggen regift friend zone whats sink teeth food w,aman
https://wikimedia.org,wikimedia global movement whose mission bring free educational world various projects chapters support structure nonprofit foundation strives world every single human freely share sum knowledge wikimedia page available creative commons attributionshare alike license terms use privacy policy,aman
https://quizlet.com,subjects expert solutions sign experience new era aienhanced learning quizlet flashcards global platform join community eoo million learners using quizlets practice tests aipowered tools improve grades reach goals ace classes suite study create magic notes get flashcards tests click meet qchat tutor engage highly responsive partner find trustworthy solutions expertwritten started magically transform saves time turning,aman
https://starfall.com,store parentteacher center join sign starfall nomor advertising collect personal information children sell information uses internal website management using site agree use updated privacy policy accessibility help contact terms starfall children fun learn founded dari stephen schutz difficulty learning read child due dyslexia motivated create platform untimed multisensory,aman
https://wordreference.com,language forums direct links english dictionaries grammar usage verb conjugators tools word lists referencecom englishspanish spanishenglish spanishfrench spanishportuguese spanishitalian spanishgerman spanish definition synonyms conjugations englishfrench frenchenglish frenchspanish french englishitalian italianenglish italianspanish italian italian català definició englishgerman germanenglish germanspanish englishdutch dutchenglish englishswedish swedishenglish englishicelandic e,aman
https://harvard.edu,main harvard university search public service bagus every students faculty staff alumni across globe use time talents serve bagus helping hands global undergraduates graduate volunteer wide range fields local community beyond read difference makers fellows advocating others building community creating opportunities learn home learn aramides work love care explore motivates dari jim dentist goes washingto,aman
https://edmodo.com,domain edmodocom registered may masih available parked free courtesy go daddycom get blocked copyright ioe daddy llc benar reservedprivacy policy disclaimer references specific company product services site controlled llc constitute imply association endorsement third party advertisers,aman
https://brainyquote.com,home authors topics quote inspirational quotes brainy like facebook follow twitter instagram popular motivational life music positive funny attitude alone beauty friendship albert einstein confucius winston churchill aristotle sun tzu mark twain socrates oscar wilde friedrich nietzsche kanye west news guy lafleur jean kerr larry hagman sophia loren faith hill linmanuel miranda judy blume bebe rexha chuck jones dolores huerta todays birthdays stephen king iei wel,aman
https://phoenix.edu,___ main bottom chat email text chatbot chat email save time money online college degree life work school experience could help graduate faster kurang review eligible credits find program start youre ready bachelors oct masters dates scholarships every qualifying new student explore degrees certificates courses business healthcare technology education nursing behavioral science criminal justice psychology liberal arts earn careerrelevant,aman
https://sporcle.com,quizzes events quiz creation community videos private sign categories badges playlists create lab random worlds largest community play join virtual live event theres sporcle everyone played movies iom history celebrity images entertainment united states geography terrible jokes xvi fun around perimeter france os new published hang nomor knowledge surfing required hejman hangman song penguins meercats em finish youll get songwri,aman
https://collegeboard.org,open global navigation panel college board sign starts personalized recommendations psatnmsqt sat apa scores create account see remaining sat test dates free resources class join code explore career possibilities psatnmsqt psat student score reports students central preap springboard big future search scholarships scholarship quiz accuplacer clep higher edisi css profile power faids find right name missiondriven,aman
https://stanford.edu,stanford university information students faculty staff families visitors alumni search news events academics research health care campus life admission explore main purposeful founded almost years ago bedrock societal purpose mission contribute world educating lives leadership contribution advancing fundamental knowledge cultivating creativity accelerating solutions amplifying impact stories people research innovation across far,aman
https://ixl.com,ixl learning sign remember assessment analytics takeoff inspiration membership personalized comprehensive ki curriculum math language arts science social studies spanish trusted educators parents billion questions answered million students use immersive experience recommendations realtime diagnostic awards become member get toolkit strategies resources successful school families high know helps schoolers create ow,aman
https://funbrain.com,funbrain logo games reading videos playground math zone search browse grade prek ke advertisement report ada tinybops coral reef explore underwater sea creatures play new like grades earth chess popular night howl watch charlie solves rubiks cube papa cloudys laundromat books diary wimpy kid read cat broke internets back kid survive funny fr vine time desert dive dino investi gators teaser breakfast business survival guide activity book ki,aman
https://ratemyprofessors.com,sign enter school get started like look professor name grammarly install write better helpful desktop app join rmp family love rmp lets make official manage edit ratings always anonymous dislike altice usa news inc benar reserved site uses third party advertising partners use similar technologies collect identifiers ip address device ids marketing purposes described privacy policy con,aman
https://k12.com,unlock childs full potential enroll today call search website online education done right help child reach potential personalized learning ki play video find school near outside select grades enter zip code state go ki every student deserves built meet unique needs school path success pace place engaging curriculum supports individual styles ki students experience quality focused skillbuilding socialization flexib,aman
https://berkeley.edu,main students faculty staff parents alumni give map directory connected news admissions academics research campus life public university uc berkeley ranks amongst universities world report forbes oea rankings photo neil freese uc shares ranking top creating venturefunded startup companies studententrepreneur alishba imran dont wait change events sep bunker optimism pessimistic finishedunfinished design bauer wurster hall field notes art,aman
https://utexas.edu,main university texas austin header helpful links current students faculty staff alumni families visitors maps directory ut direct give apply search academics admissions aid campus community research athletics news starts changes world pause button state address continues upward climb latest undergraduate rankings semiconductor boom horizon today calendar uts strategic plan impact big world new idea mind single student work art th,aman
https://mentalfloss.com,please note website includes accessibility system press controlfii adjust visually impaired using screen reader controlfio open amazing facts big questions entertainment history lists live smarter quizzes science stories newsletter cool disneys frozen halloween great advent calendars help count spookiest time tobias wartime sep food watch years american dinners minutes michele debczak list show fact every country united natio,aman
https://umich.edu,university michigan report sexual misconduct discrimination harassment search quick links prospective students current faculty staff parents alumni home academics life athletics research health medicine initiatives giving featured stories nearly zerowaste solution construction bio matters team developed fully biodegradable reusable recyclable material replace wasteful concrete formwork traditionally used across industry learn technique see complete li,aman
https://yourdictionary.com,dictionary thesaurus sentences grammar articles way words understandable credible site empowers answers questions language word uplift ŭplift instagram follow hacks amazing facts didnt even know needed your_dictionary daily comma splice examples fix subscribed newsletters get latest trends tips delivered right subscribe worlds powerful whether youre student lifelong learner,aman
https://si.edu,visit donate september october join hispanic heritage celebrate nations rich cultural vibrant performances lectures family activities smithsonian institution worlds largest museum education research complex community learning opener doors voyage discovery explore vast digital resources learn online plan virtual visitor center get information hours locations entry guidelines find whats events exhibitions select topi,aman
https://spanishdict.com,learn spanish translation conjugation sign learning made easy new course lesson getting started quiz beginner popular lessons interactive immersive every level whats first school hobbies restaurant family bahagia birthday fly away vocabulary lists custom curated word quizzes medical words verbs top colors medicine mexican music terms explore premium cheat sheets download premiumonly study materials conversation guides grammar,aman
https://mit.edu,massachusetts institute technology education research innovation admissions aid campus life search explore websites people locations rad lab ancient amazonians intentionally created fertile dark earth new study shows rich soil also holds vast stores carbon sequestered centuries indigenous practice could inform similar efforts address climate change today sep full story share twitter facebook spotlights mit community news encouraging immigr,aman
https://britannica.com,explore subscribe search britannica click quizzes games history society science tech biographies animals nature geography travel arts culture money videos september echoes eternity ancient rome lighting tik tok spurring interest roman empire didnt need social media remind romes greatness surrounded examples many fundamental fixtures civilization take grantedroads bridges concrete buildings aqueducts sewage systemsoriginated rome,aman
https://coolmath.com,main desktop header advertisement report ada calculators greatest common factor least multiple cube root calculator divide equals divisibility divisible division exponential pairs factorial finder long modulo calculator find mod number percentage ya prime factorsof number square feet converters area converter storage temperature time length mass math lessons whats converting fractions decimals order operations multiply lines finding slo,aman
https://infoplease.com,browse tools quizzes top ios history search remembrance observed september iith remember honor victims terrorist attacks occurred united states ooi reflect tragedy pay tribute lost lives weve changed since postii changes government memorial poetry want test knowledge show know interesting topics science pop culture see culture spies espionage counterintelligence geography well norther,aman
https://columbia.edu,main toggle search index email faculty students staff alumni columbia university city new york navigation expanded admissions academics research campus life news previous explore medical center libraries arts innovation athletics giving facebook twitter youtube instagram linkedin inauguration president minouche shafik wednesday october visited academic calendar deadlines holidays important dates summer session learn hundreds,aman
https://usc.edu,use similar technologies understand visitors experiences continuing website agree condition use information please see privacy notice open site navigation search frenetic love letter hiphop hip hop series threepart dance festival presented kaufman school visions voices marks hiphops oth anniversary learn top headlines visit news research selected department defense microelectronics commons hub university lea,aman
https://cornell.edu,cornell admissions academics research public engagement life covidi website apply visit give students families faculty staff alumni masters degree student persevered prison ivy league chronicle entrepreneurship researchers commercialize rareearth tech icorps help campus talk exhibit celebrate mother media psychology study reveals cancer may spread spine news everyones invited homecoming september legal experts discuss scope boundaries free expressi,aman
https://purdue.edu,main search find informasi apply news president shop visit give emergency purdue university admissions academics inclusion arts ideas research alumni athletics campuses featured giant leap signing event officially launches indianapolis learn top public wall street journaltimes higher education recognized american caldwell innovative school years running world report need worldclass engineers technologists stem leaders,aman
https://searchquotes.com,quotes questions submit quote everyone needs let go worry creative sad bahagia put smile face dreams come true funny much anonymous quote opportunity featured homepage generate random top users week iek weve updated terms privacy policy goes effect january learn protect privacy latest air atman ravi unable realize mind wanders senses desire thus continue,aman
https://vt.edu,universal toggle apply visit give shop resources virginia tech search home moves ahead read story motto ut prosimthat may serve boundless impact campaign learn innovation campus news updates site stories article hitam category abc news pierre thomas receive top journalism honor date sep experience university outlines support advantage research curious conversations podcast christina dimarino chats semiconductors packaging view play video marchin,aman
https://rosettastone.com,quieres ver esta página español español individuals enterprise schools join sign celebrate fall major savings cozy new experiences fall sayang hello joy learning languageor bring get rosetta stone unlimited lifetime immersive onthego languages ends choose languages spanish latin america second language nature helps tap brains innate ability learn language gets comfortable communication real life best way pick surr,aman
https://acronymfinder.com,new search features acronym blog free tools acronym findercom abbreviation define find word meaning location examples nfl national aeronautics space administration psp hipaa random words meaning chat global warming postal codes usa canada ta acronym abbreviation initialism stands ioooooo humanedited definitions finder worlds largest comprehensive dictionary acronyms abbreviations initialisms combined attic contains million acro,aman
https://wisc.edu,notice use site continuing browse without changing browser settings block delete agree uwmadison privacy notice accept main crest logo universityclsifillcoocclsifillcoocclsfillclsoofillclseofillurlweb_shield_blendclsafillfff search people pages open academics admissions aid student life research athletics uw utility libraries map news visit apply jobs give badgers key steps campus explore,aman
https://coursera.org,individuals businesses universities governments explore degrees find new career join free train team allinone skill development solution customers claim discount learn without limits start switch advance courses professional certificates worldclass companies try coursera business collaborate eoo leading companies launch little months view roles project manager analyst ux designer support specialist digital marketer scienti,aman
https://nyu.edu,information students faculty alumni employees community nyu home admissions academics university life research search site new york iit kanpur partner expand joint efforts explore summer programs takes quantum step establishing cuttingedge tech hub lower manhattan academic novel molecules fight viruses bursting bubblelike membranes graduate nyuniversity financial aid scholarships brainiacs episode appetiteregulating pill gorilla room faster path treatin,aman
https://instructure.com,north america utility try canvas free corp edu support contact main ki higher education resources news events get demo yes deliver dynamic learning experiences every student everywhere take teaching level canvas educational software foundation instructure platform archive course management retention made simple student archiving platform fully integrated lms backup retrieve time learn meet lesson,aman
https://washington.edu,helpful links computingit workday hcm husky card uw bothell tacoma university washington students parents faculty staff alumni quick academics apply news events research campuses give boundless investing tomorrows leaders presidential scholarship recognizes incoming undergraduates already exemplify values leadership empathy community enrichment read story meet map scholars artsuw maps myuw athletics social libraries medicine experience welcomes campus th,aman
https://udacity.com,learn plans sign new udacity subscription unlocks entire library skill stand latest tech knowledge expert instructors personalized feedback join community million learners gaining projectbased skills start free udacity business explore bestinclass artificial intelligence autonomous systems career resources cloud computing cybersecurity science executive leadership product management programming development trading months,aman
https://metmuseum.org,website maintenance pages metmuseumorg currently offline maintenance thank patience tickets member make donation visit exhibitions events art learn research shop search met plan view facade commission nairy baghramian scratching back may fifth avenue millions american culture politics ieos december roof garden lauren halsey october tree serpent early buddhist india bceaoo cewek november cecily brown death maid,aman
https://education.com,learning library sign worksheets games lesson plans activities workbooks exercises songs stories art contest receive code childs teacher click get started discover limitless world review important concepts explore new topicsthe options endless educationcom join free today browse eoooo worksheets games started digital printable resources kids learn topic theyre curious readymade make easy clas,aman
https://psu.edu,hotline give apply watch penn state vision meets action staters know real measure success goes beyond classroom gained asking questions seeking unexpected collaborating solutions always staying open new perspectives together impact world behind scenes previous ellie wheeler marley stonesifer noi nuria maeshige jasmine ward left right wait take engineering design innovation building expand opportunities unlimited community inspired,aman
https://spellingcity.com,account search help new spelling city teaching resources videos faqs premium membership mission expand knowledge vocabulary words reading comprehension try sample game step create list type spaces continue choose activity administrators teachers parents increase comprehension native english speakers read study get everything loved vsc school personalized practice multiple word exposures immediate feedback selftesting,aman
https://osu.edu,home ohio state university prev discovering new ways make useful read take step schedule visit apply explore majors creating world people need future dream create together finding solutions challenges cant wait walter ted carter jr jr respected leader well known strategic ingenuity highly collaborative leadership style named ith president university revolutionizing artificial intelligence,aman
https://ncsu.edu,students sayang hello new largestever incoming class ready think excited wolfpack meet valeria alcedos bailey find student stories spotlight campus life plan nc state spirit traditions state bucket list discover experiences define start checking list admissions university open house future families register event saturday oct wellness lighten pack academic stress personal obli,aman
https://fullsail.edu,___ request informasi apply degree programs admissions different campus online realworld education entertainment media emerging technologies explore degrees take tour full sail university offers designed world technologies include associate bachelors masters degrees well single courses course stacks offered dce online digitalcentric shortform experience sails approach centered industry experience creative masalah solving bachelo,aman
https://ucla.edu,events newsroom magazine alumni arts careers give admission academics research campus life open search ucla top stories nations nomor public university th straight increases number ca residents underrepresented students admitted fall support latino policy politics institute news features august birds kurang afraid humans pandemic closure returned normal darkeyed juncos surprisingly comfortable people source ochem kids immerses young,aman
https://yale.edu,main secondary navigation calendars give news directories search informasi students faculty staff alumni go yale academics admissions research collections life black scholars honored posthumously reckoning history stirring ceremony last week studied theology ioos couldnt formally register race read story feature archive latest explore arts humanities business campus community environment health medicine internat,aman
https://ufl.edu,informasi open resources academics admissions life uf research impact give number student outcomes announcements flu vaccines available students faculty staff schedule appointment today save date presidential inauguration campus construction impact see latest updates impacted areas news distinguished professor leads national academies panel future space spending record billion deal power outage headlines florida museum researcher advances,aman
https://mathsisfun.com,hide may use home algebra geometry numbers physics dictionary games puzzles index money calculus worksheets measurement activities messages visitors man site fabulous way described single concept helped lot studies terima kasih lot teachers page inspire class read suggestions colorable number chart line beat last updated apr helping people learn years started ith april ooo see recent additions times tab,aman
